{
  "$schema": "https://json-schema.org/draft/2020-12/schema",
  "$id": "https://openup-for-ai-agents/openup-state.schema.json",
  "title": "OpenUP iteration state (v2)",
  "description": "Machine-readable state for a single OpenUP iteration. Written by skills via scripts/openup-state.py, read by hooks. Never hand-edit. Schema 2 (T-078) names the iteration (`iteration_id`) and project cycle (`cycle`); `phase` is a derived cache. A schema-1 file is auto-migrated on read.",
  "type": "object",
  "additionalProperties": false,
  "required": [
    "schema",
    "task_id",
    "iteration",
    "iteration_id",
    "cycle",
    "phase",
    "track",
    "branch",
    "worktree",
    "session_id",
    "started_at",
    "gates",
    "iterations_since_retro"
  ],
  "properties": {
    "schema": {
      "type": "integer",
      "const": 2,
      "description": "State file schema version."
    },
    "task_id": {
      "type": "string",
      "description": "Roadmap task identifier, e.g. \"T-005\"."
    },
    "iteration": {
      "type": "integer",
      "description": "Iteration number (repo-monotonic counter, legacy)."
    },
    "iteration_id": {
      "type": ["string", "null"],
      "description": "Pointer to the iteration-plan instance that committed this lane (e.g. \"C3\"); null for a single-lane / promote-degenerate start with no multi-lane iteration plan (T-077/T-078)."
    },
    "cycle": {
      "type": "integer",
      "description": "Project lifecycle cycle counter (supports return-to-Construction; T-075). Derived from openup-lifecycle.py; defaults to 1."
    },
    "phase": {
      "type": "string",
      "enum": ["inception", "elaboration", "construction", "transition"],
      "description": "OpenUP lifecycle phase. DERIVED CACHE stamped from openup-lifecycle.py status (T-075) — not hand-set; the source of truth is the milestone decision records in docs/product/milestones/."
    },
    "track": {
      "type": "string",
      "enum": ["quick", "standard", "full"],
      "description": "Process track / weight."
    },
    "branch": {
      "type": "string",
      "description": "Git branch for the iteration."
    },
    "worktree": {
      "type": "string",
      "description": "Absolute path to the working tree."
    },
    "base_sha": {
      "type": ["string", "null"],
      "description": "Commit the lane's branch started from, stamped by openup-session.py begin (T-131); null for a state file written before this field existed. openup-fence.py's resolve_base prefers this over origin/main/main so a second lane landing on the same branch right after a first lane merged doesn't get falsely flagged OUT OF LANE for the first lane's already-merged files."
    },
    "session_id": {
      "type": ["string", "null"],
      "description": "Claude Code session id, or null if unknown."
    },
    "started_at": {
      "type": "string",
      "description": "ISO-8601 UTC timestamp when the iteration state was created."
    },
    "gates": {
      "type": "object",
      "additionalProperties": false,
      "required": [
        "team_deployed",
        "plan_persisted",
        "log_written",
        "roadmap_synced",
        "retro_due"
      ],
      "properties": {
        "team_deployed": {
          "type": "boolean"
        },
        "plan_persisted": {
          "type": ["string", "boolean"],
          "description": "false = not done; string = path to the persisted plan."
        },
        "log_written": {
          "type": "boolean"
        },
        "roadmap_synced": {
          "type": "boolean"
        },
        "retro_due": {
          "type": "boolean"
        }
      }
    },
    "iterations_since_retro": {
      "type": "integer",
      "description": "Count of iterations completed since the last retrospective."
    }
  }
}
