{
  "schema": 2,
  "task_id": "T-092",
  "iteration": 61,
  "iteration_id": null,
  "cycle": 1,
  "phase": "construction",
  "track": "standard",
  "branch": "feature/T-092-cycle-recovery-mode",
  "worktree": "/Users/germandz/personal-code/ai-dev-framework/open-up-for-ai-agents-T-092",
  "session_id": "feature/T-092-cycle-recovery-mode",
  "started_at": "2026-07-13T15:38:04Z",
  "gates": {
    "team_deployed": false,
    "plan_persisted": "docs/changes/T-092/plan.md",
    "log_written": true,
    "roadmap_synced": true,
    "retro_due": false
  },
  "iterations_since_retro": 0
}
