{
  "schema": 2,
  "task_id": "T-125-on-stop-bypass-log-exempt",
  "iteration": 0,
  "iteration_id": null,
  "cycle": 1,
  "phase": "construction",
  "track": "quick",
  "branch": "bugfix/on-stop-bypass-log-exempt",
  "worktree": "/Users/germandz/personal-code/ai-dev-framework/open-up-for-ai-agents",
  "session_id": null,
  "started_at": "2026-07-24T09:23:35Z",
  "gates": {
    "team_deployed": false,
    "plan_persisted": false,
    "log_written": true,
    "roadmap_synced": true,
    "retro_due": false
  },
  "iterations_since_retro": 0
}
