{
  "schema": 2,
  "task_id": "T-079",
  "iteration": 49,
  "iteration_id": null,
  "cycle": 1,
  "phase": "construction",
  "track": "standard",
  "branch": "feat/T-079-parallel-construction-iterations",
  "worktree": "/Users/germandz/personal-code/ai-dev-framework/open-up-for-ai-agents-T-079",
  "session_id": "feat/T-079-parallel-construction-iterations",
  "started_at": "2026-07-13T11:10:39Z",
  "gates": {
    "team_deployed": false,
    "plan_persisted": "docs/changes/T-079/plan.md",
    "log_written": true,
    "roadmap_synced": true,
    "retro_due": false
  },
  "iterations_since_retro": 0
}
