{
  "schema": 2,
  "task_id": "T-124",
  "iteration": 86,
  "iteration_id": null,
  "cycle": 1,
  "phase": "construction",
  "track": "standard",
  "branch": "fix/T-124-taskdef-convergence",
  "worktree": "/Users/germandz/personal-code/ai-dev-framework/open-up-for-ai-agents",
  "session_id": "fix/T-124-taskdef-convergence",
  "started_at": "2026-07-16T18:50:08Z",
  "gates": {
    "team_deployed": false,
    "plan_persisted": "docs/changes/T-124/plan.md",
    "log_written": true,
    "roadmap_synced": true,
    "retro_due": false
  },
  "iterations_since_retro": 2
}
