{
  "schema": 2,
  "task_id": "T-098",
  "iteration": 68,
  "iteration_id": null,
  "cycle": 1,
  "phase": "construction",
  "track": "standard",
  "branch": "fix/T-098-navigator-bootstrap-fastpath",
  "worktree": "/Users/germandz/personal-code/ai-dev-framework/open-up-for-ai-agents-T-098",
  "session_id": "fix/T-098-navigator-bootstrap-fastpath",
  "started_at": "2026-07-13T18:56:27Z",
  "gates": {
    "team_deployed": false,
    "plan_persisted": "docs/changes/T-098/plan.md",
    "log_written": true,
    "roadmap_synced": true,
    "retro_due": false
  },
  "iterations_since_retro": 0
}
