{
  "schema": 2,
  "task_id": "T-117",
  "iteration": 1,
  "iteration_id": null,
  "cycle": 1,
  "phase": "inception",
  "track": "standard",
  "branch": "feat/T-117-doctor-fix",
  "worktree": "/Users/germandz/personal-code/ai-dev-framework/open-up-for-ai-agents-T-117",
  "session_id": "feat/T-117-doctor-fix",
  "started_at": "2026-07-15T06:42:39Z",
  "gates": {
    "team_deployed": false,
    "plan_persisted": "docs/changes/T-117/plan.md",
    "log_written": true,
    "roadmap_synced": true,
    "retro_due": false
  },
  "iterations_since_retro": 0
}
