{
  "schema": 2,
  "task_id": "T-080",
  "iteration": 50,
  "iteration_id": null,
  "cycle": 1,
  "phase": "construction",
  "track": "standard",
  "branch": "feat/T-080-reference-driver-benchmark",
  "worktree": "/Users/germandz/personal-code/ai-dev-framework/open-up-for-ai-agents-T-080",
  "session_id": "feat/T-080-reference-driver-benchmark",
  "started_at": "2026-07-13T11:32:21Z",
  "gates": {
    "team_deployed": false,
    "plan_persisted": true,
    "log_written": true,
    "roadmap_synced": true,
    "retro_due": false
  },
  "iterations_since_retro": 0
}
