{
  "schema": 2,
  "task_id": "T-144",
  "iteration": 0,
  "iteration_id": null,
  "cycle": 1,
  "phase": "construction",
  "track": "quick",
  "branch": "quick/20260727-072420-claude-md-t135-staleness",
  "worktree": "/Users/germandz/personal-code/ai-dev-framework/open-up-for-ai-agents",
  "base_sha": null,
  "session_id": null,
  "started_at": "2026-07-27T07:24:20Z",
  "gates": {
    "team_deployed": false,
    "plan_persisted": false,
    "log_written": true,
    "roadmap_synced": true,
    "retro_due": false
  },
  "iterations_since_retro": 0
}
