{
  "schema": 2,
  "task_id": "T-136",
  "iteration": 93,
  "iteration_id": null,
  "cycle": 1,
  "phase": "construction",
  "track": "standard",
  "branch": "feat/T-136-authoring-reliability-measure",
  "worktree": "/Users/germandz/personal-code/ai-dev-framework/open-up-for-ai-agents-T-136",
  "base_sha": "469a62ac57c2e8e46687621395bc1d64e7f7b6ba",
  "session_id": "feat/T-136-authoring-reliability-measure",
  "started_at": "2026-07-27T06:48:38Z",
  "gates": {
    "team_deployed": false,
    "plan_persisted": "docs/changes/T-136/plan.md",
    "log_written": true,
    "roadmap_synced": true,
    "retro_due": false
  },
  "iterations_since_retro": 1
}
