{
  "schema": 2,
  "task_id": "T-088",
  "iteration": 58,
  "iteration_id": null,
  "cycle": 1,
  "phase": "construction",
  "track": "quick",
  "branch": "feat/T-088-ship-driver",
  "worktree": "/Users/germandz/personal-code/ai-dev-framework/open-up-for-ai-agents-T-088",
  "session_id": "feat/T-088-ship-driver",
  "started_at": "2026-07-13T14:24:47Z",
  "gates": {
    "team_deployed": false,
    "plan_persisted": "docs/changes/T-088/plan.md",
    "log_written": true,
    "roadmap_synced": true,
    "retro_due": false
  },
  "iterations_since_retro": 0
}
