{
  "schema": 2,
  "task_id": "T-111",
  "iteration": 77,
  "iteration_id": null,
  "cycle": 1,
  "phase": "construction",
  "track": "quick",
  "branch": "fix/T-111-next-cycle-passthrough",
  "worktree": "/Users/germandz/personal-code/ai-dev-framework/open-up-for-ai-agents-T-111",
  "session_id": "fix/T-111-next-cycle-passthrough",
  "started_at": "2026-07-14T11:57:11Z",
  "gates": {
    "team_deployed": false,
    "plan_persisted": false,
    "log_written": true,
    "roadmap_synced": true,
    "retro_due": false
  },
  "iterations_since_retro": 0
}
