{
  "schema": 2,
  "task_id": "T-084",
  "iteration": 54,
  "iteration_id": null,
  "cycle": 1,
  "phase": "construction",
  "track": "quick",
  "branch": "feat/T-084-bench-archive-deliverable",
  "worktree": "/Users/germandz/personal-code/ai-dev-framework/open-up-for-ai-agents-T-084",
  "session_id": "feat/T-084-bench-archive-deliverable",
  "started_at": "2026-07-13T13:52:41Z",
  "gates": {
    "team_deployed": false,
    "plan_persisted": "docs/changes/T-084/plan.md",
    "log_written": true,
    "roadmap_synced": true,
    "retro_due": false
  },
  "iterations_since_retro": 0
}
