{
  "schema": 2,
  "task_id": "T-123",
  "iteration": 85,
  "iteration_id": null,
  "cycle": 1,
  "phase": "construction",
  "track": "standard",
  "branch": "feat/T-123-dirty-aware-gating",
  "worktree": "/Users/germandz/personal-code/ai-dev-framework/open-up-for-ai-agents",
  "session_id": "feat/T-123-dirty-aware-gating",
  "started_at": "2026-07-16T16:51:26Z",
  "gates": {
    "team_deployed": false,
    "plan_persisted": "docs/changes/T-123/plan.md",
    "log_written": true,
    "roadmap_synced": true,
    "retro_due": false
  },
  "iterations_since_retro": 1
}
