{
  "schema": 2,
  "task_id": "T-103",
  "iteration": 72,
  "iteration_id": null,
  "cycle": 1,
  "phase": "construction",
  "track": "standard",
  "branch": "feat/T-103-retire-navigator",
  "worktree": "/Users/germandz/personal-code/ai-dev-framework/open-up-for-ai-agents-T-103",
  "session_id": "feat/T-103-retire-navigator",
  "started_at": "2026-07-14T08:09:31Z",
  "gates": {
    "team_deployed": false,
    "plan_persisted": "docs/changes/T-103/plan.md",
    "log_written": true,
    "roadmap_synced": true,
    "retro_due": false
  },
  "iterations_since_retro": 0
}
