{
  "schema": 2,
  "task_id": "T-091",
  "iteration": 66,
  "iteration_id": null,
  "cycle": 1,
  "phase": "construction",
  "track": "standard",
  "branch": "feat/T-091-cycle-assess-milestone",
  "worktree": "/Users/germandz/personal-code/ai-dev-framework/open-up-for-ai-agents-T-091",
  "session_id": "feat/T-091-cycle-assess-milestone",
  "started_at": "2026-07-13T17:32:28Z",
  "gates": {
    "team_deployed": false,
    "plan_persisted": "docs/changes/T-091/plan.md",
    "log_written": true,
    "roadmap_synced": true,
    "retro_due": false
  },
  "iterations_since_retro": 0
}
