{
  "schema": 2,
  "task_id": "T-116",
  "iteration": 79,
  "iteration_id": null,
  "cycle": 1,
  "phase": "construction",
  "track": "standard",
  "branch": "feat/T-116-hook-sweep-parity",
  "worktree": "/Users/germandz/personal-code/ai-dev-framework/open-up-for-ai-agents-T-116",
  "session_id": "feat/T-116-hook-sweep-parity",
  "started_at": "2026-07-14T14:39:01Z",
  "gates": {
    "team_deployed": false,
    "plan_persisted": "docs/changes/T-116/plan.md",
    "log_written": true,
    "roadmap_synced": true,
    "retro_due": false
  },
  "iterations_since_retro": 0
}
