{
  "schema": 2,
  "task_id": "T-128",
  "iteration": 88,
  "iteration_id": null,
  "cycle": 1,
  "phase": "construction",
  "track": "standard",
  "branch": "claude/agent-maintainability-measurement-vtjw1e",
  "worktree": "/home/user/open-up-for-ai-agents",
  "session_id": "claude/agent-maintainability-measurement-vtjw1e",
  "started_at": "2026-07-25T12:10:51Z",
  "gates": {
    "team_deployed": false,
    "plan_persisted": "docs/changes/T-128/plan.md",
    "log_written": true,
    "roadmap_synced": true,
    "retro_due": false
  },
  "iterations_since_retro": 1
}
